Mohammed Shami	Mohammed Shami Ahmed	September 3, 1990, Amroha, Uttar Pradesh 	30 years 178 days	India, Bengal, Delhi Daredevils, ICC World XI, India A, Kings XI Punjab, Kolkata Knight Riders	Bowler	Right-hand bat	Right-arm fast	25	India v Pakistan at Delhi, Jan 6, 2013	"Mohammed Shami was India's leading fast bowler in the 2015 World Cup in Australia, when the team marched into the semi-finals and picked up 77 out of 80 wickets on offer. It was later revealed that he had played through that entire tournament - and the preceding Test series against the hosts, essentially four months - through a knee injury. His success can be attributed to his pace, accuracy and primarily his skill in moving the ball - both old and new.  
 There were plenty of frustrating times as well. Shami was hopeful of a return to the Indian team in early 2016, but a hamstring injury ruled him out a limited-overs tour of Australia and the Asia Cup in February. He was selected in a 15-man squad for the World T20 in March, but was unable to break into the XI having spent a year out of international cricket. 
 Shami hails from Uttar Pradesh, but plays first-class cricket for Bengal from where he was noticed. He had played only 15 first-class and 15 List A games when he was drafted into India's ODI team to play Pakistan in Delhi in January 2013. He showed the faith wasn't misplaced and returned figures of 9-4-23-1 in a 10-run win, thus becoming only the eighth bowler, and the first Indian, to bowl four or more maiden overs on his ODI debut. His Test debut, which happened in November that year against the touring West Indies, was even more spectacular. He reverse-swung the old ball appreciably,  and at good pace, in the two-match series to take 11 wickets at 16.54. In the summer that followed in England, Shami and Bhuvneshwar Kumar, recorded the second-highest 10th wicket partnership for India in Tests, when they put on 111 runs against England in Nottingham. 
 Shami's quick promotion to international cricket was the result of impressive performances in the 2012-13 Ranji Trophy: in five matches he took 28 wickets at 21.35, including two ten-wicket hauls, against Madhya Pradesh and Hyderabad. He has also enjoyed early success in the Twenty20 format, picking up 14 wickets in his first eight domestic Twenty20 games, and was signed by Kolkata Knight Riders for the 2011 IPL season. He got his first game for them in 2013, and was acquired by Delhi Daredevils in 2014, who retained him in 2016 despite his missing the entire 2015 season with injury. ESPNcricinfo staff"	"=HYPERLINK(""https://www.espncricinfo.com/inline/content/image/1223375.html"",""Mohammed Shami"")"	India
Mitchell Starc	Mitchell Aaron Starc	January 30, 1990, Baulkham Hills, Sydney, New South Wales 	31 years 29 days	Australia, Australia A, Australia Under-19s, New South Wales, New South Wales Second XI, New South Wales Under-17s, New South Wales Under-19s, Royal Challengers Bangalore, Sydney Sixers, Western Suburbs, Yorkshire	Bowler	Left-hand bat	Left-arm fast	52*	India v Australia at Visakhapatnam, Oct 20, 2010	First there was Johnson, then there was Starc. A left-armer called Mitchell has been a staple of Australia's attack for more than a decade and seems set to remain so for the foreseeable future. While Johnson was more express, Starc is still quick enough to make life uncomfortable for opposition batsmen, especially with the bounce gained from his 1.96m height - and boasts greater control of swing than his older colleague. Never was that shown to greater effect than during the 2015 World Cup, when Starc was at times unplayable, his inswingers rattling stumps and trapping batsmen in front throughout the competition. Not surprisingly he was named Player of the Tournament for his 22 victims at 10.18, and his challenge was to take that white-ball form and perform just as consistently with the red ball. Starc struggled to gain the consistent backing of the selectors early in his Test career and was often in one Test and out the next, but in 2015 he finally enjoyed a solid run of Test cricket until an ankle injury stopped him during the home summer. His career-best match haul of 11 for 94 came in the notable surroundings of Galle - albeit in an Australia defeat - and he claimed 22 wickets in four Tests during the 2017-18 Ashes. He took his 200th Test wicket in his 50th Test in February of 2019 joining an elite group of Australian bowlers. Also a powerful lower-order batsman, Starc fell one short of a Test century in Mohali in 2013. Starc is married to Australia women's wicketkeeper Alyssa Healy. ESPNcricinfo staff	"=HYPERLINK(""https://www.espncricinfo.com/inline/content/image/1099513.html?alt=1"",""Mitchell Starc"")"	Australia
Adil Rashid	Adil Usman Rashid	February 17, 1988, Bradford, Yorkshire 	33 years 11 days	England, Adelaide Strikers, Azeem Rafiq's XI, Bangla Tigers, Dhaka Dynamites, England Development Programme Under-19s, England Lions, England Performance Programme, England Performance Programme XI, England Under-19s, ICC World XI, Marylebone Cricket Club, Marylebone Cricket Club, Middlesex Cricket Board, Punjabi Legends, South Australia, South Australia, Team James Vince, Team Morgan, Yorkshire, Yorkshire 2nd XI	Bowler	Right-hand bat	Legbreak	69	Ireland v England at Belfast, Aug 27, 2009	"Young spinners in England will always make headlines if they take wickets. When it is a young legspinner the hype is magnified. When it is a young spinner of Pakistani extraction, brought up in Yorkshire, the sense of excitement becomes palpable. Adil Rashid, the player who above all symbolized Yorkshire's growing success in fostering strong relationships in its minority ethnic communities, burst onto the scene with six wickets against Warwickshire on his first-class debut in 2006 at Scarborough. There was a sense in Yorkshire's much-loved seaside town that afternoon as Rashid cut through Warwickshire that a historic breakthrough had been made and more than one Yorkshire supporter observed Rashid's performance with hearts uplifted. 
 A decade later, as he left a tour of India in which England had been trounced 4-0, it was still occasionally possible to see the vulnerable, taciturn 18-year-old of whom Yorkshire were so protective. Rashid had 10 Test caps, all of them in the UAE or South Asia where England needed a second spinner, but even on such surfaces he needed careful handling in case his leg spin succumbed under the pressure. He seemed happiest in limited-overs cricket where the game unfolded in a more predictable fashion and he knew that batsmen would be committed to attack. It was hard to imagine him as a single spinner in England unless he became more serviceable, but such had been remarked of countless legspinners before him.
 A five-wicket haul on debut against Pakistan in Abu Dhabi after a return of 0 for plenty in the first innings augured well (setting up a short run chase which England narrowly failed to achieve) and he also brushed up well a year later in Dhaka at the start of England's 2016-17 tour of Bangladesh and India. His India series gradually took a turn for the worse, however, the promise of Rajkot and Visakhapatnam giving way to a more pessimistic air - and some hefty figures in the runs column - in Mumbai and Chennai. He had the ability to hoover up a tail at both England and county level; sometimes the problem was getting to it.
 In the limited-overs formats, Rashid was a vital component of England's attack and a first-class average with the bat in the mid-30s told of a player who would not have been consigned to the tail in many England XIs in the past.
 Rashid's also caught the eye early in his career for England Under-19s nd an eight-wicket haul during the second Test against India. But he suffered a stress fracture in his back in the close season which forced him to remodel his action. His profile rose further in 2007 when he struck his maiden Championship century against Worcestershire in August and at the end of the season the Cricket Writers' Club made him their Young Cricketer of the Year. In 2008 he enjoyed his most prolific season with 62 wickets in the County Championship and was a late addition to the squad for the Test series in India. That trip was purely for experience, however, as was the tour to West Indies which followed, but even so his career shone with potential.
 Rashid responded the following season with 545 runs at 68.12, including two hundreds, and picked up 31 wickets at 36.06 in the 2009 first-class season. His statistics in one-day and Twenty20 cricket were more modest, but the selectors held faith in his potential, and he made his England debut during the World Twenty in June of that year. He also played in the post-Ashes one-day series against Australia, but his most notable achievement came with the bat when he scored a quickfire 31 in a narrow defeat at The Oval.
 Rashid was included in the party to tour South Africa in 2009-10, but had a difficult time on the trip. He began amid high hopes that his combination of legspin and promising lower-order batting could cement a permanent role in the side, but his solitary over in the second Twenty20 went for 25, then he bowled three overs for 27 in the second ODI before being left out for a fit-again Graeme Swann. When he was released from the one-day party, James Tredwell, the Kent offspinner, remained on stand-by which suggested Rashid had fallen down the pecking order. 
 Andy Flower, England's coach, rightly suggested that he would benefit from a chance to deepen his game at county level, but progress was not immediate. Yorkshire, by now, were showing signs of disquiet over Rashid's bowling. England had demanded that he bowled much quicker and his confidence and method had deserted him when he returned from international duty. His county form faltered, although he did win a place in the England Lions squad to tour UAE and was called-up briefly for the end of the World Cup campaign.
 At home, Rashid enjoyed his most productive season for Yorkshire in 2010, scoring 732 first-class runs at 45.75 and taking 57 wickets at 31.29. He began the 2011 season with a bang, taking 6 for 77 and 5 for 37 to secure victory against Worcestershire at New Road, the best figures for a leg-spinner in Yorkshire history, but failed to maintain his form, finishing the season with 39 wickets at 43.38. From 10 Championship matches in 2012 he totalled only 16 wickets and 129 runs and his discontent was apparent. 
 Rashid was at a crossroads. But more than 800 Championship runs at 50-plus in 2013 suggested that in his mid-20s not just his batting was maturing, and his bowling became more thoughtful, and dangerous in turn with a good googly particularly evident. Yorkshire's challenge was to bring his career to fruition, to bring him not just success on the field but a general contentment. A career that had begun with so much optimism began to reawaken England's interest again - cagily at first with a Lions recall - as Yorkshire won the title in 2014. The appointment of Trevor Bayliss as coach coincided with his return to the England side for the first time in nearly six years, a string of limited-overs displays being joined by limited success in his first three Tests, against Pakistan on the slow, big turners of the UAE.
 He was a much-loved figure on Yorkshire grounds, contributing to back-to-back Championships in 2014 and 15, and dubbed ""The Hoover"" by the head coach Jason Gillespie. But his request to rest out a title decider against Middlesex at Lord's the following year - he later explained that his grandmother was unwell - exasperated his captain, Andrew Gale. Gale's appointment as Yorkshire's coach at the end of the season suggested that conversation was not entirely finished.
 ESPNcricinfo staff"	"=HYPERLINK(""https://www.espncricinfo.com/inline/content/image/1185618.html?alt=1"",""Adil Rashid"")"	England
Hashmatullah Shahidi	Hashmatullah Shahidi	November 4, 1994, Logar 	26 years 116 days	Afghanistan, Afghanistan A, Afghanistan Under-19s, Amo Region, Band-e-Amir Region, Speen Ghar Region	Top-order batsman	Left-hand bat	Right-arm offbreak	97*	Afghanistan v Kenya at Sharjah, Oct 2, 2013	Hashmatullah Shaidi is a young left-handed batsman whose hard work in Afghanistan's age group teams eventually allowed him to break into the senior squad. Shaidi started his journey in the Under-17 side and was included in Afghanistan's squad for the 2010 Under-19 World Cup in New Zealand. Four years later, he was part of the Under-19 team that beat Australia and Sri Lanka, and was rewarded with a spot in the squad for Afghanistan's first full tour of Zimbabwe. His favourite shot is the cover-drive and he idolises Kumar Sangakkara.Liam Brickhill	"=HYPERLINK(""https://www.espncricinfo.com/inline/content/image/1221780.html"",""Hashmatullah Shahidi"")"	Afghanistan
Bhuvneshwar Kumar	Bhuvneshwar Kumar Singh	February 5, 1990, Meerut, Uttar Pradesh 	31 years 23 days	India, Australian Institute of Sport, Central Zone, India A, India Blue, India Emerging Players, India Red, Indian Tobacco Company, Pune Warriors, Royal Challengers Bangalore, Sunrisers Hyderabad, Uttar Pradesh, Uttar Pradesh Cricket Association XI	Bowler	Right-hand bat	Right-arm medium	53*	India v Pakistan at Chennai, Dec 30, 2012	"Bhuvneshwar Kumar, like the other wily Kumar, Praveen, comes from Meerut, a northern Indian town known for - among other things - the industrial production of sports goods, most famously those under the brand SG. No wonder then that once thrown the new SG ball, Bhuvneshwar can make it hoop around corners, mostly back into the right-hand batsman but he gets it to hold its line often enough to be a genuine threat. Like the other Kumar, though, Bhuvneshwar operates at a middling pace of early 130s, but India weren't spoilt enough for choices to deny him an international debut season at the age of 22, in late 2012. Bhuvneshwar said a roaring hello to international cricket. In his first international over, he bowled Nasir Jamshed; with his first ODI delivery, he bowled Mohammad Hafeez; and in his first Test series he played a part in India's first whitewash of a four-Test series. Apart from the swing, Bhuvneshwar's control of it and his cricketing smartness stand out. It stood out the time when he, as a 19-year-old, worked Sachin Tendulkar over for his first first-class duck in Indian domestic cricket. The cricketing smartness showed with the bat too when he scored 128 batting at No. 8, winning a Duleep Trophy semi-final in 2012-13, just before his selection for India.  
 Bhuvneshwar was one of the lone bright spots in an otherwise wretched tour of England, taking 19 wickets at 26.63, an Indian record for most wickets against England in a Test series. He was dragged down by injury in Australia and played only one game in the 2015 World Cup.Sidharth Monga "	"=HYPERLINK(""https://www.espncricinfo.com/inline/content/image/1223359.html"",""Bhuvneshwar Kumar"")"	India
Thisara Perera	Narangoda Liyanaarachchilage Thisara Chirantha Perera	April 3, 1989, Colombo 	31 years 331 days	Sri Lanka, Chennai Super Kings, Colts Cricket Club, Dhaka Platoon, Gloucestershire, Guyana Amazon Warriors, ICC World XI, Jaffna Stallions, Kings XI Punjab, Kochi Tuskers Kerala, Melbourne Renegades, Montreal Tigers, Multan Sultans, Mumbai Indians, Quetta Gladiators, Rising Pune Supergiants, Sri Lanka A, Sri Lanka Under-19s, St Kitts and Nevis Patriots, St Lucia Zouks, Sunrisers Hyderabad, Wayamba, World-XI	Bowling allrounder	Left-hand bat	Right-arm medium-fast	140	India v Sri Lanka at Kolkata, Dec 24, 2009	"A bustling right-arm seamer and sporadically effective left-handed hitter, Thisara Perera has been been in Sri Lanka's short-format sides since 2010. Bowling is ostensibly Perera's major skill but, often deployed in the lower-middle order, he is also capable of delivering furious finishes to an innings. Perera is particularly severe on spin, which has led to his being used as a pinch-hitter through the middle overs, but he has at times also been weak to quality pace bowling.  
 He is the kind of player for whom form in one discipline usually bleeds into the other. Dropped for the limited-overs series against South Africa in July 2014, but roared back in the following ODI series against Pakistan, getting his bowling and his hitting in order. He struck 78 runs at a rate of 169.56 and claimed a series-high nine wickets at an average of 10.66. 
 Perera has also done well with bat and ball on previous tours to Australia, and has often been at his best against India, memorably slamming the straight six that completed Sri Lanka's World T20 triumph in 2014. His more recent years have been beset by inconsistency but Perera continues to command a place in the side. He has hat-tricks in both ODIs and T20s.
 Perera began his schooling at St Anthony's, Wattala, before accepting a scholarship to join St Joseph's College. It turned out to be a productive move as he teamed up with Angelo Mathews and produced many noteworthy performances in the thriving schools cricket scene. Perera played a key role in helping his school break the hoodoo in the Battle of the Saints (against St Peters College) that lasted more than 35 years. He received his maiden national call-up during Sri Lanka's tour of India in 2009 as an emergency replacement for Mathews. 
 That quickly led to an IPL contract, as he was bought by Chennai Super Kings for $50,000, and he has been one of the few Sri Lanka players to consistently find employment in the competition.Andrew Fidel Fernando"	"=HYPERLINK(""https://www.espncricinfo.com/inline/content/image/1099840.html?alt=1"",""Thisara Perera"")"	Sri Lanka
Noor Ali Zadran	Noor Ali Zadran	July 10, 1988, Khost, Afghanistan 	32 years 233 days	Afghanistan, Mis Ainak Region	Opening batsman	Right-hand bat	Right-arm medium-fast	114	Afghanistan v Canada at Colombo (SSC), Feb 4, 2010		"=HYPERLINK(""https://www.espncricinfo.com/inline/content/image/979089.html?alt=1"",""Noor Ali Zadran"")"	Afghanistan
Chris Morris	Christopher Henry Morris	April 30, 1987, Pretoria, Transvaal 	33 years 304 days	South Africa, Chennai Super Kings, Delhi Capitals, Delhi Daredevils, Hampshire, Lions, Nelson Mandela Bay Giants, North West, North West Invitation XI, Rajasthan Royals, Royal Challengers Bangalore, South Africa A, South African Invitation XI, South African XI, St Kitts and Nevis Patriots, Surrey, Sydney Thunder, Titans	Bowling allrounder	Right-hand bat	Right-arm fast-medium	62	Pakistan v South Africa at Birmingham, Jun 10, 2013	"The IPL's biggest South African beneficiary must be Chris Morris, who sold for US$625,000 at the 2013 auction and US$1 million three years later. Morris is a bowling allrounder, who often sends the speedgun beyond 140kph and bats fearlessly in the lower-order. He is also a handy slip-fielder, and in that regard, he takes after his father, former Northern Transvaal first-class cricketer Willie.  
 Morris was a late bloomer, who made his first-class debut at 22 and only came to the attention of the national selectors when he was well into his mid-20s. He finished the 2011-12 season as the leading wicket-taker in the domestic T20 competition, with 21 scalps at 12.66 and was picked to play a T20 tri-series in Zimbabwe. 
 Later that year, he showed his skills for his franchise, the Lions, in the 2012 Champions League. Morris combined with the likes of Sohail Tanvir and Dirk Nannes to provide a powerful seam attack and take the team to final of the competition. On the basis of that tournament, he was one of the big buys of IPL and went to Chennai Super Kings for more than 31 times his base price of US$20,000
 Despite his T20 fame, Morris insisted he was not a limited-overs specialist and the numbers backed him up. Morris had a promising 2010-11 first-class season, when he averaged over 60 with the bat, albeit in the provincial, not franchise division, in South Africa. He also led the Lions' charge in the 2012-13 Sunfoil Series and finished with 32 wickets at 16.00 and three years later was rewarded with a Test call-up. 
 In the 2015-16 summer, with South Africa's bowling reserves depleted by injury, Morris debuted at the New Year's Test against England. He made more of an impression as a batsman with 69 in his first match and he took that form into limited-overs' cricket as well. 
 Six days after being picked up by Delhi Daredevils for a millions dollars, Morris proved his worth. He struck 62 off 38 balls to see South Africa draw level in the fourth match of a five-game rubber against England and later took them to a similarly thrilling win in a T20. Morris' bowling did not light up the park in the same way and he struggled through the 2016 World T20. Fridose Moonda"	"=HYPERLINK(""https://www.espncricinfo.com/inline/content/image/1100157.html?alt=1"",""Chris Morris"")"	South Africa
Shai Hope	Shai Diego Hope	November 10, 1993, Barbados 	27 years 110 days	West Indies, Barbados, Barbados Tridents, Barbados Under-19s, Northamptonshire, UWI Vice Chancellor's XI, West Indies Board President's XI, WICB President's Celebrity XI	Wicketkeeper batsman	Right-hand bat		170	Sri Lanka v West Indies at Harare, Nov 16, 2016	"Shai Hope made his Test debut as a 21-year-old, having played just 14 first-class matches at the time. But few in the Caribbean doubted his talent as a batsman. Clive Lloyd gave him his West Indies cap, and coach Stuart Law insisted that he only needed one innings to get going. The world eventually got to know why the boy from Barbados was rated so highly when he became the first player, in 534 first-class matches, to score a hundred in each innings at Headingley. 
  Hope was 23 at the time, the youngest member of the XI, leading West Indies to victory with scores of 147 and 118 not out. They had been faced with a target of 322 - not since Bradman's Invincibles rocketed to 404 for 3 in 1948 had a team chased that many on Yorkshire's storied turf, and won. Adding to the occasion was the fact West Indies had been dismantled only a week ago, England beating them by an innings and 209 runs to ensure their fans could savour the advent of day-night Test cricket in the country. 
 Hope made his first-class debut in 2012-13, but propelled himself into consideration for the West Indies team after a superb season in 2014-15, when he scored 628 runs in nine matches - he was the fourth-highest run-getter in the tournament. He racked up 538 runs at 67.25 in 2015-16 - the highest average among the top-10 - and secured his maiden first-class double-hundred at his homeground, Kensington Oval, in March 2017ESPNcricinfo staff"	"=HYPERLINK(""https://www.espncricinfo.com/inline/content/image/1225947.html?alt=1"",""Shai Hope"")"	West Indies
Mitchell Santner	Mitchell Josef Santner	February 5, 1992, Hamilton 	29 years 23 days	New Zealand, Barbados Tridents, Chennai Super Kings, Derbyshire, New Zealand A, New Zealand Cricket XI, New Zealand Cricket XI, New Zealand Masters, New Zealand Masters, New Zealand XI, Northern Districts, Northern Districts A, Northern Districts Under-19s, Worcestershire, Worcestershire 2nd XI	Bowling allrounder	Left-hand bat	Slow left-arm orthodox	67	England v New Zealand at Birmingham, Jun 9, 2015	"A left-handed batsman and left-arm spinner, Mitchell Santner was first elevated to the New Zealand side after a promising 2014-15 domestic season.  
 He was named in the one-day squad for the tour of England following the retirement of Daniel Vettori after the World Cup as New Zealand searched for another left-arm spin option. Santner was in to cover for the absence of the players at the IPL but made an immediate impression with a well-crafted 94 in a tour game against Somerset. He was handed his ODI debut at Edgbaston having played just 19 List A matches for Northern Districts. ""It's nice to have a left-arm spinner who turns,"" was a quip from the New Zealand camp.
 He made his Test debut later that year in the first ever day-night Test against Australia in Adelaide and made 31 and 45 batting at No.6 in both innings in a low-scoring game. He also took two wickets. Over the next four years his Test opportunities were limited but he became a mainstay in the white-ball teams for the Black Caps. 
 His performances were so impressive that he was bought by the Chennai Super Kings in 2019 IPL to play under Stephen Fleming. He won a game by hitting a six off the last ball of the match against Rajasthan and took 2 for 13 from 4 overs in the IPL final against Mumbai, including the prized scalp of Rohit Sharma. 
 His experience in that cauldron held him in good stead for the 2019 World Cup in England. He bowled a clutch spell in the semi-final win over India, strangling their middle order to help secure a spot in the final against England. 
 Later in the same year he recorded a maiden Test century during an epic partnership with BJ Watling. The 261 they added was New Zealand's highest seventh-wicket stand in history and helped their side to 615-9, their highest Test total against England. The three wickets he claimed in England's second-innings also constituted new Test-best figures and helped New Zealand to a crushing innings victory.
 ESPNcricinfo staff"	"=HYPERLINK(""https://www.espncricinfo.com/inline/content/image/1222457.html"",""Mitchell Santner"")"	New Zealand
