Mushfiqur Rahim	Mohammad Mushfiqur Rahim	May 9, 1987, Bogra 	33 years 295 days	Bangladesh, Bangladesh Under-19s, Beximco Dhaka, Karachi Kings, Khulna Tigers, North Zone (Bangladesh), Rajshahi Division, Rajshahi Kings, Sylhet Division, Sylhet Royals	Wicketkeeper batsman	Right-hand bat		144	Zimbabwe v Bangladesh at Harare, Aug 6, 2006	"A wild-card inclusion for Bangladesh's maiden tour of England in 2005, Mushfiqur Rahim was just 16 when he was selected for that daunting trip - two Tests in May, followed by six ODIs against England and Australia - even though he hadn't been named in the preliminary squad of 20. Mushfiqur was principally selected as an understudy to the ever-present wicketkeeper, Khaled Mashud, but his inclusion was further evidence of Bangladesh's determination to build for a better future. He had done well on an A-team tour of Zimbabwe earlier in 2005, scoring a century in the first Test at Bulawayo, and also enjoyed some success in England the previous year with the Under-19s, making 88 in the second Test at Taunton. He showed more evidence of grit with the full team, with a maiden first-class half-century to soften the pain of defeat against Sussex, followed by a career-best 115 against Northamptonshire. That earned him a call-up - as a batsman - to become the youngest player to appear in a Test match at Lord's. He was one of only three players to reach double figures in a disappointing first innings, but a twisted ankle kept him out of the second Test. After captaining Bangladesh's Under-19s to fifth place in the Youth World Cup in February 2006, he also featured in Bogra's inaugural Test, against Sri Lanka the following month, but could make little of the spin of Murali and Malinga Bandara. He remained on the sidelines for the next few months but was recalled for the final two ODIs against Zimbabwe at home in December.  He scored his maiden half-century at Harare in February 2007 and was picked as the first-choice wicketkeeper, ahead of Khaled Mashud, for the World Cup in the West Indies. 
 He shows sound technique in his glovework and is Bangladesh's first-choice wicketkeeper after Dhiman Ghosh's departure to the ICL. A stodgy lower-order batsman, Mushfiqur has grown into one of the better players of spin in the line-up. After a slow start to his Test career, he found form in the 2008-09 season with stubborn knocks under pressure. He has under-performed as a batsman in ODIs, but his form picked up in 2009 and he narrowly missed out on a maiden ODI hundred on the tour to Zimbabwe. In January 2010 he cracked his maiden Test century, a notable achievement as it came against a strong Indian Test side and was the fastest by a Bangladesh player. And after Bangladesh's unexpected defeat in Zimbabwe in 2011, Mushfiqur was also elevated to leadership role, taking over as captain from Shakib Al Hasan. Andrew Miller and ESPNcricinfo staff"	"=HYPERLINK(""https://www.espncricinfo.com/inline/content/image/1221580.html"",""Mushfiqur Rahim"")"	Bangladesh
Rahmat Shah	Rahmat Shah Zurmatai	July 6, 1993, Paktia 	27 years 237 days	Afghanistan, Afghan Cheetas, Mis Ainak Region, Mohammedan Sporting Club	Allrounder	Right-hand bat	Legbreak googly	114	Afghanistan v Scotland at Sharjah, Mar 6, 2013		"=HYPERLINK(""https://www.espncricinfo.com/inline/content/image/1221796.html"",""Rahmat Shah"")"	Afghanistan
Sabbir Rahman	Mohammad Sabbir Rahman	November 22, 1991, Rajsahi 	29 years 98 days	Bangladesh, Bangladesh A, Bangladesh Cricket Board Academy, Bangladesh Under-19s, Bangladesh Under-23s, Barisal Burners, Barisal Division, Beximco Dhaka, Comilla Warriors, Cumilla Warriors, Peshawar Zalmi, Rajshahi Division, Sylhet Sixers	Middle-order batsman	Right-hand bat	Legbreak	102	Bangladesh v Zimbabwe at Chattogram, Nov 21, 2014	"Sabbir Rahman shot into the limelight with an 18-ball unbeaten 33 in the gold-medal match of the 2010 Asian Games against Afghanistan. Bangladesh needed 44 from the last five overs of the T20 game, and Sabbir coolly struck three sixes to ensure the country's first gold in the Asian Games itself. 
 He had earlier turned heads with his big-spinning legbreaks in the Dhaka club scene as well as for the Bangladesh U19 side in the 2010 U19 World Cup, but he chose the Guangzhou International Cricket Stadium to launch himself.
 He continued to flourish in T20 cricket for the next two seasons but his lack of runs in first-class and one-day cricket held him back. Finally he was chosen to play for Bangladesh in 2014 in his favoured format, but it wasn't a great start. He made his ODI debut towards the end of the year and although not the finished article nor a proven player at this level, he was chosen in their 2015 World Cup squad.
 Born in Rajshahi, Sabbir possesses exceptional fielding skills and is a handy legspinner: he took a six-wicket haul in the 2014-15 Dhaka Premier League. As a batsman he can be a big hitter, but is a better batsman when he tries to play straight and square on the off side.Mohammad Isam"	"=HYPERLINK(""https://www.espncricinfo.com/inline/content/image/1221741.html"",""Sabbir Rahman"")"	Bangladesh
Aaron Finch	Aaron James Finch	November 17, 1986, Colac, Victoria 	34 years 103 days	Australia, AJ Finch's XI, Auckland, Australia A, Australia Centre of Excellence, Australia Under-19s, Australian Cricketers Association All-Stars, Australian XI, Cricket Australia Invitation XI, Cricket Australia XI, Delhi Daredevils, Gujarat Lions, Kings XI Punjab, Marylebone Cricket Club, Melbourne Renegades, Mumbai Indians, Pune Warriors, Rajasthan Royals, Royal Challengers Bangalore, Ruhuna, Sunrisers Hyderabad, Surrey, Victoria, Victoria Emerging Players, Victoria Second XI, Victoria Under-15s, Victoria Under-17s, Victoria Under-19s, Victoria XI, Yorkshire, Yorkshire XI	Top-order batsman	Right-hand bat	Slow left-arm orthodox	153*	Australia v Sri Lanka at Melbourne, Jan 11, 2013	"A solidly-built, aggressive batsman from the country town of Colac in south-west Victoria, Aaron Finch ascended to become Australia's permanent ODI and T20I captain. He also made his Test debut in 2018 on the back of his white-ball form but the experiment of turning him into a Test opener only lasted five matches.  
 He has twice held the record for the highest score in a T20I, his career-best 172, made against Zimbabwe in 2018, surpassing his 156 than he took off England in 2013 - an innings that included 14 sixes. In 2014, Finch was named Australia's T20I captain, replacing George Bailey, but on the eve of the 2016 T20 World Cup in India the selectors decided to consolidate the captaincy of all three formats and handed the job to Steven Smith. Finch at the time was the No.1-ranked T20I batsman in the world, but found himself suddenly struggling to hold on to his place in the side. He had been an automatic selection in Australia's ODI and T20 teams, and had set the tone for their triumphant 2015 World Cup with 135 in their opening match against England at the MCG. 
 In 2018, amid a meltdown in Australian cricket centered around the ball-tampering scandal at Newlands, Finch found himself installed as the permanent national white-ball captain and was selected to make his Test match debut against Pakistan in the UAE despite a modest first-class record. Finch made 62 and 49 on debut in Dubai but endured a form slump in the home 2018-19 season after trying to adjust his technique to Test cricket and was dropped from the Test side after five matches. 
 He had made his first-class debut for Victoria aged 21 in a tour match against India in 2007 but did not play his first Sheffield Shield match until two years later.  Victoria had not always viewed Finch in their preferred Sheffield Shield batting order, and nearly three years came between his second and third first-class centuries from 2011 to 2014. He made an unbeaten 288 against New Zealand in a first-class tour match in Blacktown in 2015-16, although that match was ultimately abandoned as the New Zealanders complained about the condition of the pitch. 
 Finch is an in-demand T20 cricketer having played for seven IPL franchises as well as Yorkshire and Surrey in England. He has also been a mainstay of the Melbourne Renegades side since the inception of the BBL and captained the Renegades to their first BBL title in 2019.ESPNcricinfo staff"	"=HYPERLINK(""https://www.espncricinfo.com/inline/content/image/1223018.html"",""Aaron Finch"")"	Australia
Isuru Udana	Isuru Udana Tillakaratna	February 17, 1988, Balangoda 	33 years 11 days	Sri Lanka, Basnahira Greens, Chilaw Marians Cricket Club, Colombo Kings, Combined Provinces, Dambulla, Duronto Rajshahi, Galle Guardians, Hambantota Troopers, Kandy, MAS Holdings-Active, Montreal Tigers, Nondescripts Cricket Club, Paarl Rocks, Punjab Riders, Puttalam District, Royal Challengers Bangalore, Ruhuna, Sindhis, Sri Lanka A, Sri Lanka Board XI, Sri Lanka Cricket Academy, Sri Lanka Cricket Board President's XI, Sri Lanka Cricket Invitation XI, Sri Lanka Ports Authority Cricket Club, Sri Lanka Ports Authority Cricket Club, Sri Lanka Under-19s, Sri Lanka Under-20s School, Sri Lanka Under-20s School, Tamil Union Cricket and Athletic Club, Tamil Union Cricket and Athletic Club, Wayamba, Wayamba, Wayamba United	Allrounder	Right-hand bat	Left-arm medium-fast	78	Australia v Sri Lanka at Nottingham, Jun 8, 2009	"Udana is a talented left-arm fast-bowling allrounder, whose variety and changes of pace have seen him appear sporadically for Sri Lanka's T20 side. Capable of moving the ball off the seam, Udana is possessed of a number of slower balls, including one out of the back of his hand that has brought him some success at the top level. He was fast-tracked into the Sri Lanka squad for the 2009 World T20 in England and played a role in Sri Lanka's progress to the final in that tournament. However, he did not play the 2010 World T20, and had largely been ignored by the national selectors until early 2017. 
  While still a schoolboy, at DS Senanayake College, he joined Nondescripts CC, but even before he could represent them in a domestic match he was selected to play for Sri Lanka Under-20 Schools side in the ongoing U-23 Division I youth tournament. He was selected to tour South Africa with the Sri Lanka A team in August 2008 without having played a single first-class match, and was the leading wicket-taker in the Inter-Provincial T20 tournament in 2008-09, helping Wayamba to the title and a berth in the Champions Twenty20 League.  ESPNcricinfo staff "	"=HYPERLINK(""https://www.espncricinfo.com/inline/content/image/1224722.html"",""Isuru Udana"")"	Sri Lanka
Dwaine Pretorius	Dwaine Pretorius	March 29, 1989, Randfontein 	31 years 336 days	South Africa, Lions, North West, South Africa Emerging Players, South Africa Under-19s	Bowling allrounder	Right-hand bat	Right-arm medium-fast	50	South Africa v Ireland at Benoni, Sep 25, 2016	"An allrounder who swapped pace for precision because of twin knee injuries, Dwaine Pretorius is a late bloomer whose batting is as important as his bowling. In the post-Jacques Kallis era, Pretorius' away swingers and lower-order runs earned his first international call-up in 2016. 
 That was eight years after Pretorius was named in South Africa's under-19 squad for the 2008 World Cup. He never got to the tournament because he tore a cartilage in his right knee. Having seen the fragility of a sportsman's career, Pretorius put it aside as an option and chose to study instead. Three years later, armed with an accounting degree, he decided to give cricket another go.
 Pretorius joined the North-West provincial side in the 2010-11 season and only got a look-in for the final game of the summer. He scored 53 and took 5 for 38, and became a regular member of the side the following season. In 2011-12, he was named the T20 Amateur Cricketer of the Year and was included in the Lions' squad for the 2012 Champions League T20, but the knee flared up again and he required surgery.
 When Pretorius returned, he stopped striving for speed and shelved the idea of bowling 140+. Instead, he operated in the mid-130s and tried to emulate Vernon Philander's accuracy. He earned a franchise contract in the 2014-15 season and was named the South African Cricketers' Association's MVP in 2015. In winter 2016, he traveled with the South Africa A squad to play a quadrangular competition in Australia and in September 2016, he was called up to South Africa's ODI squad to play Ireland. Although Pretorius was only due to play that game, he was retained for the ODI series against Australia when Wayne Parnell was injured.
 Pretorius was called up to South Africa's Test squad to Australia in November after Dale Steyn broke his shoulder, on the back of strong batting performances in South Africa's first-class competition.
 Firdose Moonda"	"=HYPERLINK(""https://www.espncricinfo.com/inline/content/image/1100160.html?alt=1"",""Dwaine Pretorius"")"	South Africa
Lasith Malinga	Separamadu Lasith Malinga	August 28, 1983, Galle 	37 years 184 days	Sri Lanka, Basnahira, BCCSL Academy XI, Galle Cricket Club, Galle Gladiators, Guyana Amazon Warriors, Jamaica Tallawahs, Kandy, Kent, Khulna Titans, Maratha Arabians, Melbourne Stars, Montreal Tigers, Mumbai Indians, Nondescripts Cricket Club, Palace Diamonds, Rangpur Riders, Ruhuna, Ruhuna Reds, Ruhuna Royals, Southern Express, Southern Province, Sri Lanka A, Sri Lanka Board XI, Sri Lanka Cricket XI, Sri Lanka Emerging Team, Sri Lanka Masters, Sri Lanka Schools XI, St Lucia Zouks	Bowler	Right-hand bat	Right-arm fast	56	Sri Lanka v United Arab Emirates at Dambulla, Jul 17, 2004	"One of the great limited-overs bowlers in his pomp, Lasith Malinga gained a reputation for delivering searing inswinging yorkers from a round-arm action as destructive as it was distinctive. That yorker, a deceptive slower ball, and an excellent bouncer formed the body of Malinga's menace, while the action made his deliveries hard to pick up. All that ability was also set off by street smarts; Malinga was rarely shy to switch up plans, and reshuffle fields. Even when batsmen thought they knew what was about to come, Malinga retained the capacity to surprise. 
 Found in his teens playing soft-ball cricket on the beaches of Rathgama, just north of Galle, Malinga became one of the poster boys for the informal Sri Lankan coaching system and its philosophy of equipping unconventional bowlers, rather than remaking them. Malinga has repeatedly credited Champaka Ramanayake for his success. It was Ramanayake who initially took interest in him, and with whom he developed the yorker that became the foundation of his career. The coach would glue a pair of shoes near the popping crease. Malinga would spend hours bowling at them. 
 Initially picked for his pace, Malinga toured Australia with the Sri Lanka team in 2004, where he claimed 6 for 90 in a tour match and went on to make his Test debut - he dismissed Darren Lehmann and Adam Gilchrist in the same over, in Darwin. During an impressive tour of New Zealand the following year, his low-slung action resulted in the New Zealand batsmen asking the umpire to change the colour of their trousers as the ball was getting lost.
 But it was in the shorter formats that destiny beckoned Malinga. He became the first - and, so far, only - bowler to claim four wickets in four balls, when he took Sri Lanka to the brink of victory against South Africa, in the 2007 World Cup. He has two more ODI hat-tricks - against Australia and Kenya - and he quickly established himself as Sri Lanka's limited-overs spearhead. Though Mahela Jayawardene, Kumar Sangakkara and Tillakaratne Dilshan also played important roles, Malinga was arguably the single-most important player in Sri Lanka's excellent run in global tournaments from 2007-2014.
 It is felt Malinga never realised his full potential in Tests, though perhaps through no fault of his own. He was only the third player to reach 100 Test wickets for Sri Lanka but a knee injury in 2008 laid him low for two years. He was picked again for Muttiah Muralitharan's farewell series, but again found himself injured for a period of some months. In April 2011, at the age of 27, Malinga announced his Test retirement, citing the desire to manage his ""chronic knee injury"" and extend his limited-overs career. It is thought his unique bowling action places a substantial load on the joints in his hips and legs. However, the fact that he announced his retirement while playing for Mumbai Indians in the IPL rankled at home. Through the forthcoming years, Malinga would go on to have a complicated relationship with Sri Lankan fans and media. In that time, he also became one of the IPL's iconic figures, representing Mumbai throughout.
 Malinga's finest moment came during the 2014 World T20, in which he nominally captained the side through the knockouts but, more importantly, delivered a clinical final spell to muzzle the India middle order. Sri Lanka would go on to win that title but, before long, Malinga's career became threatened by fitness issues - both involuntary and self-inflicted. In late 2014, a long-standing ankle complaint deteriorated to the extent that it required surgery. Malinga was a diminished force through the 2015 World Cup and became significantly slower in his later years, in which he also put on weight. 
 He stepped down as T20 captain ahead of Sri Lanka's 2016 World T20 campaign, again owing to a chronic knee injury, this time in his left leg. He has at times suggested that his career hangs in the balance as a result of these injuries. At others he has said he wishes to play on for another few years. Andrew Fidel Fernando"	"=HYPERLINK(""https://www.espncricinfo.com/inline/content/image/1224627.html"",""Lasith Malinga"")"	Sri Lanka
Rohit Sharma	Rohit Gurunath Sharma	April 30, 1987, Bansod, Nagpur, Maharashtra 	33 years 304 days	India, Air India, Deccan Chargers, India A, India Blue, India Green, India Red, India Under-19s, Indian Board President's XI, Indian Oil Corporation XI, Mumbai, Mumbai Cricket Association President's XI, Mumbai Cricket Association XI, Mumbai Indians, Mumbai Under-19s, Rest of India, West Zone	Top-order batsman	Right-hand bat	Right-arm offbreak	264	Ireland v India at Belfast, Jun 23, 2007	"For a large part of his career, it seemed Rohit Sharma's biggest gift was his biggest burden. Languid, easy on the eye, all shots in his armoury, Sharma emerged from Mumbai's suburbs as the heir apparent to the batting greats of the 2000s. Ironically his IPL franchise nicknamed him ""Hitman"" when he was anything but: more caresser, less hitter.  
 However, it took time and persistence for him to become the double-hundred machine and IPL-winning phenomenon that he eventually became.  
  
 That Sharma had the talent was apparent to both the casual observer and to the trained eye. So while it took time for that batting talent to translate into runs, the casual observers kept getting frustrated, and the trained eyes of the selectors and captains kept backing him. It had Sharma frustrated too, who began to hate the word ""talent"", which became a pejorative nickname for him on social media. Once it all clicked, though - move to open the batting in ODIs late in 2012 was one particular turning point - it did so spectacularly.
  
 Sharma scored ODI double-hundreds for fun, won five IPLs in its first 12 editions, scored five hundreds at the 2019 ODI World Cup, and when he finally got to open in Tests in 2019, three quick hundreds in his first series, one of them a double. Sharma became one of the colossal six-hitters of his era. So spectacular and certain was his acceleration that people began anticipate a double-century every time he went past a score of 50.
  
 Along the way, his captaincy at Mumbai Indians, whom he led to four titles, won plaudits. He was methodical, studious and calm, using all available technology and data to arrive at decisions. He was an able deputy to Virat Kohli in limited-overs formats in international cricket, winning India two titles in Kohli's absence.Sidharth Monga"	"=HYPERLINK(""https://www.espncricinfo.com/inline/content/image/1220570.html"",""Rohit Sharma"")"	India
Liton Das	Liton Kumar Das	October 13, 1994, Dinajpur 	26 years 138 days	Bangladesh, Bangladesh Under-15s, Bangladesh Under-19s, Bangladesh Under-23s, Dhaka Gladiators, East Zone (Bangladesh), Gazi Group Chattogram, Jamaica Tallawahs, North Zone (Bangladesh), Rajshahi Royals, Rangpur Division	Wicketkeeper batsman	Right-hand bat		176	Bangladesh v India at Dhaka, Jun 18, 2015	"Liton Das is the first wicketkeeper-batsman in Bangladesh considered good enough to be a long-term successor to Mushfiqur Rahim. His domestic exploits for Abahani in the Dhaka Premier League and Rangpur Division in the National Cricket League in the 2014-15 season earned him recognition and later a call-up in the senior side for the Test against India in Fatullah in June 2015. 
 Hailing from the northern district of Dinajpur, which is around 331km from capital Dhaka, Liton began his adolescent life as a young cricketer in BKSP. He impressed one and all with his heavy run-scoring in school and age-group cricket. He was soon picked in Bangladesh's Under-19 side in 2012, the usual route for any talented young cricketer from BKSP and soon enough, he scored heavily in Youth ODIs too. In two Under-19 World Cups in 2012 and 2014, Liton averaged 51.33 with a century and three fifties.
 A compact batsman with a good defensive technique and flair in his strokeplay, he quickly got into domestic first-class cricket in the 2011-12 season. He scored a century and a fifty in his second season but due to preparation for the 2014 Under-19 World Cup in the UAE, he played just two first-class matches in the 2013-14 season.
 In the 2014-15 season, he hit big time when he was the second highest-scorer in the Dhaka Premier League for Abahani and later the top-scorer in the first first-class tournament of the season, the NCL. He was soon called into Bangladesh's T20 squad against Pakistan in April 2015 before being handed a Test debut against India in June. He also made his ODI debut against India in the same series.Mohammad Isam"	"=HYPERLINK(""https://www.espncricinfo.com/inline/content/image/1221378.html"",""Liton Das"")"	Bangladesh
Colin de Grandhomme	Colin de Grandhomme	July 22, 1986, Harare 	34 years 221 days	New Zealand, Auckland, Jamaica Tallawahs, Kolkata Knight Riders, Manicaland, Midlands, Nagenahira Nagas, New Zealand A, Royal Challengers Bangalore, St Lucia Zouks, Warwickshire, Zimbabwe Under-19s	Allrounder	Right-hand bat	Right-arm medium-fast	74*	New Zealand v South Africa at Auckland, Mar 3, 2012	"A bruising, broad-shouldered batsman, and a disciplined medium-pace bowler, Colin de Grandhomme left Zimbabwe for Auckland in 2006, before eventually finding his way into New Zealand's representative teams. Unsurprisingly, his first international foray was in the T20 format. Having earned a reputation as a heavy hitter in New Zealand's domestic T20 competition, de Grandhomme earned a debut against his native Zimbabwe in 2012. He did not sufficiently impress to keep his place on that occasion, but continued to flourish on the domestic circuit.  
 In 2016, an unbeaten fourth-innings 144 off 147 balls, to lead Auckland's successful chase of 373, put him back into national reckoning, this time in the Test format. But it was with the ball that he left his first significant impression on international cricket; his 6 for 41 against Pakistan on a Christchurch green-top were the best figures for a New Zealand debutant, bettering a 65-year-old record. 
 From then on he was a fairly regular member of the New Zealand team in all three forms. He made his first Test century against West Indies in December 2017. He played a significant role in the 2019 World Cup, making a brilliant 47-ball 60 in a nail-biting winning chase against South Africa and 64 against Pakistan. In the extraordinary final against England, he was unplayable at times while bowling a vital spell taking 1 for 25 from 10 overs including the prized wicket of Joe Root. 
 De Grandhomme had represented Zimbabwe at the Under-19 World Cup in 2003-04, and broke into the Manicaland side in 2004-05 before ascending to Zimbabwe A and Zimbabwe Under-23s, for whom he scored a century against Eastern Province in the SAA Provincial Challenge. Soon, though, de Grandhomme felt his future lay outside Zimbabwe, and he quickly made a mark in Auckland. In 2008-09, he averaged 54.50 with the bat and 24.19 with the ball as Auckland won the State Championship.
 In June 2009 he was named in a New Zealand Emerging Players team to take part in a quadrangular tournament in Australia. His figures in the Plunket Shield in the 2009-10 season were again strong, though his domestic limited-overs form was somewhat disappointing. A steady show in 2010-11 - during which he was part of the Auckland side that won the domestic one-day tournament and wrested the Twenty20 title from Central Districts - resulted in another call-up to the New Zealand Emerging Players team in 2011. He has scored over 600 runs in a season three times, since 2011, and it was his performance over several years, as much as the rapid 144*, that earned him a Test call-up.Liam Brickhill and ESPNcricinfo staff"	"=HYPERLINK(""https://www.espncricinfo.com/inline/content/image/1222371.html"",""Colin de Grandhomme"")"	New Zealand
