Mark Wood	Mark Andrew Wood	January 11, 1990, Ashington, Northumberland 	31 years 48 days	England, England XI, Chennai Super Kings, Durham, Durham 2nd XI, Durham Academy, England Lions, Northumberland, Northumberland Under-13s, Northumberland Under-15s, Northumberland Under-17s	Bowler	Right-hand bat	Right-arm fast	13	Ireland v England at Dublin (Malahide), May 8, 2015	"It looked, for a while, as if Mark Wood would be another of those fast bowlers who promised more than they delivered. 
 An apparently relentless succession of injuries - particularly injuries to his ankle - threatened to either end his career or turn him into another fast medium seamer who compromised his pace for a longer career in the game.
 But Wood was not to be denied. Abandoning a short run-up that was a characteristic of his career up until the latter part of 2018, Wood instead reasoned a longer approach to the crease would put less pressure on his body and allow him to hit the speeds his early career had promised.
 The results were dramatic. Returning to the England team for the final Test of the Caribbean tour in early 2019, Wood claimed a maiden five-wicket haul and generated speeds of around 95 mph in a remarkably hostile demonstration of fast bowling. Scyld Berry, the veteran Telegraph correspondent and a man believed to have seen more England Tests than anyone else, rated it the quickest spell he had ever seen by an England bowler.
 There was more to come. Recalled to the ODI side just before the World Cup, he went on to play a huge role in the team's eventual success. With Jofra Archer he traded records for the quickest deliveries of the tournament - both exceeded 95 mph - and, by offering pace and wicket-taking potential in the middle-overs, ensured his captain always had a potent weapon in the field. While Archer finished with more wickets (21 to Wood's 18), Wood finished with the better strike-rate. 
 Underlining his commitment to the cause, Wood sustained a serious sides strain during the final but, with the match in the balance, continued to bowl at high pace. He was subsequently ruled out of the Ashes series that followed.
 Wood never did fit the prototype of a modern England fast bowler. He is skinny, barely 6ft tall and, originally at least, bowled from a sprinter's run-up but after his speed caught the eye with Durham and the Lions, he was given a Test debut at the start of the 2015 summer. He made an instant impression against New Zealand, bowling above 90mph and celebrating wickets with abandon, kept his place for the visit of Australia and capped things off by taking the wicket that sealed England's Ashes victory at Trent Bridge. In no time at all, the imaginary horse that had ridden around the county grounds of England to stave off boredom had become a recognisable part of his England celebration. Here was a fast bowler of unsuppressed vitality.
 Like Stephen Harmison, Wood hails from Ashington in Northumberland and played for the same club. The former England quick also encouraged him to go to Australia at 18 to improve his game - not bad advice from a man who suffered bouts of homesickness away from the Northumberland coast. Where Harmison stands 6ft 4in tall, Wood is a level 6ft and delivers a whippier, skiddier ball. In his first five first-class appearances, he took 19 wickets at 21.63, including a match-winning 5 for 78 against Nottinghamshire at Trent Bridge in August 2012.
 Paul Collingwood's appetite for promoting and encouraging Durham's younger crop of players worked in his favour in 2013. He had a breakthrough summer, claiming 27 first-class wickets at 24.07 to help Durham to the Championship title and confirm his status as the latest in an impressive collection of homegrown pace bowlers. That strong showing was enough to win recognition on the England Lions tour to Sri Lanka, though it lasted only one match before he returned home with a side injury. His 2014 season was further disrupted by the first appearance of a long-running ankle problem but he was again involved with the Lions at the start of 2015 before being called up to the Test squad for the Caribbean.
 He did not get a run against West Indies but was capped in the washed-out ODI against Ireland, picking up his first England wicket, and then replaced Chris Jordan in the Test side for a Lord's debut. Wood thought he had taken the wicket of Martin Guptill in his third over, only for replays to show he had overstepped, but he eventually finished with 4 for 140 as England won a thriller. Further limited-overs involvement followed but England were already aware Wood's workload would need careful managing - he played the first two Ashes Tests but missed out at Edgbaston. James Anderson's side strain allowed him to return at Trent Bridge and he took one of the two wickets not claimed by Stuart Broad as Australia were dismissed for 60. Two days later, the imaginary horse got an outing after Wood took the wicket that secured the return of the urn.
 He made a blistering comeback from injury in the second half of 2016, delivering some of the most potent fast-bowling spells of the season as he helped Durham's to the final of the NatWest T20 Blast and also featured in England's 4-1 victory over Pakistan in their one-day international series. But further ankle issues ruled him out of a tour to Bangladesh and he missed India, too, after it was discovered that he bowled at the tail end of the English domestic season when his ankle was fractured. It all meant that he faced a third ankle operation within a year and, however optimistic the prognosis, cast doubts upon the resilience of a player who had won a reputation as England's fastest bowler. His comeback in 2017 was then afflicted by heel problems which limited him to five early-season Championship matches, somewhat down on pace, and saw him lose his England central contract at the end of the season.
 Lost England contract or not, England could not resist his potential. He sandwiched a disastrous debut in the IPL (conceding 49 in four overs for Chennai Super Kinds and never seen again) in between Tests in Christchurch and against Pakistan at Lord's, where his average pace  of 87mph restated his threat, but his ODI displays were unpredictable and he admitted in Sri Lanka that he was running out of opportunities to claim his place for the 2019 World Cup.
 Wood played minor counties cricket for Northumberland from 2008 to 2010 before making his first-class debut for Durham against Durham MCCU in April 2011. He made his List A debut against Northamptonshire in Clydesdale Bank 40 the following month and his first County Championship appearance against Nottinghamshire in August of the same year.ESPNcricinfo staff
 "	"=HYPERLINK(""https://www.espncricinfo.com/inline/content/image/1222880.html"",""Mark Wood"")"	England
Chris Gayle	Christopher Henry Gayle	September 21, 1979, Kingston, Jamaica 	41 years 160 days	West Indies, Balkh Legends, Barisal Burners, Chattogram Challengers, Chittagong Vikings, D Ganga's XI, Dhaka Gladiators, Dolphins, Hooper XI, ICC World XI, Jacobs XI, Jacques Kallis Invitational XI, Jamaica, Jamaica Tallawahs, Jozi Stars, Kandy Tuskers, Karachi Kings, Kings XI Punjab, Kolkata Knight Riders, Lahore Qalandars, Lions, Marylebone Cricket Club, Matabeleland Tuskers, Melbourne Renegades, Quetta Gladiators, Rangpur Riders, Royal Challengers Bangalore, RR Sarwan's XI, Somerset, St Kitts and Nevis Patriots, Stanford Superstars, Sydney Thunder, Vancouver Knights, West Indies Under-19s, Western Australia, Worcestershire	Allrounder	Left-hand bat	Right-arm offbreak	215	India v West Indies at Toronto, Sep 11, 1999	"A thrusting Jamaican left-hander, Gayle earned himself a black mark on his first senior tour - to England in 2000 - where the new boys were felt to be insufficiently respectful of their elders. But a lack of respect, for opposition bowlers at least, has served Gayle well since then. Tall and imposing at the crease, he loves to carve through the covers off either foot, and has the ability to decimate the figures of even the thriftiest of opening bowlers. And in this era of Twenty20 cricket, Gayle is the batsman who has thrived like no other. 
 Among his many strengths, perhaps the biggest one is his outstanding hand-eye coordination, which allows Gayle to regularly hit even good-length deliveries for boundaries. Technique and footwork aren't his greatest assets, but most often he compensates with other skills. No batsman has taken to the 20-over format like he has. He showed early signs of his liking for that format by smashing the first century in Twenty20 internationals - a 57-ball 117 against South Africa in the World Twenty20 in 2007 - and when Twenty20 leagues mushroomed the world over and sought international stars, Gayle was the biggest beneficiary. 
 Over two seasons - 2011 and 2012 - of the IPL, he became easily the most feared batsman of the league, smashing more hundreds and sixes than any other batsman, by far. When he carted Pune Warriors all over the ground to score an unbeaten 175 in IPL 2013, it felt right that he should finally own the record for highest individual score, fastest century, and most sixes in a Twenty20 innings, because no batsman has dominated Twenty20 cricket like he has. 
 Gayle's free-stroking, aggressive style is obviously best suited for limited-overs cricket, but that doesn't mean he hasn't cut it as a Test batsman. When he has turned up for West Indies, his pugnacious approach has become an attacking weapon in its own right, in what's been a lean era for West Indian cricket. His 79-ball century at Cape Town in January 2004, on the back of a South African first innings of 532, was typical of his no-holds-barred approach. However, Gayle has also shown the ability to bat long periods and the hunger to make big scores. In 2009 against Australia, Gayle batted almost seven-and-a-half hours in scoring an unbeaten 165 to save the Test in Adelaide; in the very next game, though, he smashed the fifth-fastest Test century - off 70 balls - to indicate that quick-scoring remained his preferred method. Next year he batted almost ten hours and scored 333 against Sri Lanka and Muralitharan in Galle, becoming only the fourth batsman to score two triples in Tests, thus proving again his ability to bat long periods.
 And then there is also his brisk non-turning offspin, with which he has turned himself into a genuine allrounder in limited-overs cricket. His tendency to stay aloof on the field sometimes suggests he isn't interested in the proceedings, but his relaxed approached was good for the team whenever he led West Indies. However, West Indies have missed his services far too often due his differences with their board. During his exile, he was a Twenty20 regular in various leagues around the world, entertaining crowds in Australia, Zimbabwe and Bangladesh. After a long spell out from international cricket he returned strongly in 2012 on the tour of England and subsequently at home against New Zealand.ESPNcricinfo staff"	"=HYPERLINK(""https://www.espncricinfo.com/inline/content/image/1232572.html"",""Chris Gayle"")"	West Indies
Faf du Plessis	Francois du Plessis	July 13, 1984, Pretoria 	36 years 230 days	South Africa, Chennai Super Kings, Edmonton Royals, Kent, Lancashire, Lancashire 2nd XI, Melbourne Renegades, Nicky Oppenheimer XI, North Eastern Transvaal, Northerns, Nottinghamshire 2nd XI, Paarl Rocks, Peshawar Zalmi, Quetta Gladiators, Rising Pune Supergiants, South Africa A, South Africa Academy, South Africa Under-19s, South Africa XI, St Kitts and Nevis Patriots, Titans, World-XI	Middle-order batsman	Right-hand bat	Legbreak	185	South Africa v India at Cape Town, Jan 18, 2011	"Classy, composed and a fine crafter of innings', Faf du Plessis emerged as one of South Africa's most consistent batsmen in the post-Jacques Kallis era. Du Plessis is strong on the front foot, has impeccable defences and enjoys spending time at the crease. A natural leader, du Plessis was put in charge of the T20 side in February 2013 and formed part of the senior core in other formats.  
 All that may have been lost when, in 2007, du Plessis signed a Kolpak deal with Lancashire. Unlike his high-school contemporary, AB de Villiers, du Plessis did not manage to fast-track himself into the international spotlight and looked abroad for other opportunities. Apart from learning the rigours of the county system, du Plessis made a name for his fielding.
 He returned to South Africa to play domestic cricket every summer and topped the MTN40 run charts in the 2010-11 season. His Kolpak deal had expired by then and he was selected in South Africa's one-day squad for the home series against India in January 2011. A half-century on debut sealed his spot for the World Cup that followed. At that point, du Plessis was known as an aggressive ball-striker and quick run-scorer.
 He was part of the South Africa Test squad that took the Test mace off England in mid-2012, but did not play a game, instead getting a T20 debut on that tour. He got his Test chance on South Africa's tour to Australia later that year and followed his first-innings 78 in the second Test in Adelaide with a stonewalling effort for the ages in the second innings. Du Plessis spent more than seven-and-a-half hours at the crease, faced 376 balls and remained unbeaten on 110 to take South Africa to an unlikely draw, which set them up for a series win in Perth.
 His curve continued upwards when in December that year, du Plessis was given the T20 captaincy in a series against New Zealand, despite only having played four T20Is prior to that. He was then given the role permanently the following February. Du Plessis had established himself as a complete batsmen, who had the ability to shift gears and anchor an innings, and played a similar knock against India in December 2013. His 134 in the second innings of the Johannesburg Test took South Africa within eight runs of completing the highest successful Test chase, 458, and in the end secured a draw. When Kallis retired after the next match, du Plessis was an automatic choice for promotion to No.3. 
 It took du Plessis a little longer to repeat those feats in limited-overs. In his 51st ODI, he finally scored his first century in the format, against Australia in a triangular series in Harare in August 2014, but then the floodgates opened. Two more hundreds came in that series, which South Africa won. 
 Du Plessis took good form into the 2015 World Cup, after becoming the second South African to score a T20I century after Richard Levi, in February that year. He was among those left devastated by South Africa's semi-final loss. 
 While du Plessis continued to rack up runs in ODIs, he was criticised for occasionally scoring too slowly. He started to struggle in the longest format and after managing just one fifty in 12 innings in the 2015-16 season, he was dropped for the final Test against England in January 2016. 
 Du Plessis led South Africa in two World T20 campaigns, in 2014 and 2016, and despite them returning empty-handed from both, he confirmed his desire to keep the captaincy. "	"=HYPERLINK(""https://www.espncricinfo.com/inline/content/image/1100150.html?alt=1"",""Faf du Plessis"")"	South Africa
Tabraiz Shamsi	Tabraiz Shamsi	February 18, 1990, Johannesburg, Gauteng 	31 years 10 days	South Africa, Dolphins, Easterns, Gauteng, Gauteng Under-19s, KwaZulu-Natal, KwaZulu-Natal Inland, Lions, Royal Challengers Bangalore, South Africa A, St Kitts and Nevis Patriots, Titans	Bowler	Right-hand bat	Left-arm wrist-spin	0*	Australia v South Africa at Providence, Jun 7, 2016	"A left-arm wristspin bowler with ample variations and a good googly, Tabraiz Shamsi emerged as South Africa were starting to warm to the wave of spinners being produced at domestic levels, although it took a while for him to come through.  
 Shamsi bounced between the Highveld and Kwa-Zulu Natal and pushed for a place at franchise level after a strong 2013-14 season for Easterns. He took 47 wickets at 20.02 to finish third in the three-day cup wicket-takers' list, and then played five matches in the 2014-15 franchise 20-over competition where caught the eye of the touring West Indians, who were visiting South Africa that summer. 
 In 2015, Shamsi was bought by Caribbean Premier League franchise St Kitts and Nevis Patriots, where Eric Simons was coach. There, Shamsi rose to some prominence, taking 11 wickets at 13.27 in the seven matches he played.
 More regular opportunities in franchise cricket came the next season and Shamsi took them. He finished as the leading spinner in South Africa's first-class competition in the 2015-16 summer, in which he took 41 wickets at 19.97 in Titans' title-run. In 2016, he was picked up by the IPL's Royal Challengers Bangalore as a replacement player for the injured Samuel Badree which meant that Shamsi had played in two T20 leagues before picked for the national side. 
 His ODI debut finally came in a triangular series in the Caribbean in June 2016. That same year he made his Test debut against Australia in Adelaide and the following June, he played his first T20 international. But Shamsi struggled to find a regular place in the South African side, with Keshav Maharaj established as the Test spinner and Imran Tahir their white-ball specialist. Shamsi was part of the 2019 World Cup squad and played two matches but it was only after Tahir's ODI retirement after the 2019 World Cup that Shamsi came into his own. 
 In the 2019-20 summer, he finished second on the Mzansi Super League wicket-charts and was a star performer in the Paarl Rocks' tournament-winning campaign and was afforded a regular run in white-ball series against England and Australia. In addition to his ability to take wickets, he also demonstrated the capacity to hold an end, something South Africa have always wanted from their spinners."	"=HYPERLINK(""https://www.espncricinfo.com/inline/content/image/1185196.html"",""Tabraiz Shamsi"")"	South Africa
Tom Blundell	Thomas Ackland Blundell	September 1, 1990, Wellington 	30 years 180 days	New Zealand, New Zealand Under-19s, Wellington, Wellington A, Wellington Under-19s	Wicketkeeper batsman	Right-hand bat	Right-arm offbreak	22	New Zealand v India at Hamilton, Feb 5, 2020	"An aggressive wicketkeeper-batsman with a variety of sweeps in his repertoire, Tom Blundell enjoyed a dream start to 2017. In the space of three days, he earned his maiden call-up to the New Zealand squad, as a replacement for the injured Luke Ronchi, for the third T20I against Bangladesh in Mount Maunganui, won the Super Smash - the national T20 tournament - with Wellington, and then received his maiden international cap from Corey Anderson. A couple of weeks later, Blundell was called-up to the ODI squad for the Chappell-Hadlee series at home against Australia. 
 He was part of the New Zealand U-19 World Cup squad in 2010 alongside Tom Latham, James Neesham, and Doug Bracewell. He made his first-class and List A debuts for Wellington in 2013. After an inconsistent first three seasons in domestic cricket, Blundell had a breakthrough season in 2015-16 in which he made 1073 runs in 28 matches across all formats. He followed it with 537 runs in 17 matches in the 2016-17 season. His tally of 243 runs in nine innings was the highest by a wicketkeeper-batsman in the Super Smash in 2016-17."	"=HYPERLINK(""https://www.espncricinfo.com/inline/content/image/1222470.html"",""Tom Blundell"")"	New Zealand
Ross Taylor	Luteru Ross Poutoa Lote Taylor	March 8, 1984, Lower Hutt, Wellington 	36 years 357 days	New Zealand, Australian Capital Territory, Central Districts, Central Districts Under-19s, Delhi Daredevils, Durham, Guyana Amazon Warriors, Jamaica Tallawahs, Middlesex, New Zealand Emerging Players, New Zealand Under-19s, Pune Warriors, Rajasthan Royals, Royal Challengers Bangalore, St Lucia Zouks, Sussex, Trinidad & Tobago Red Steel, Victoria	Middle-order batsman	Right-hand bat	Right-arm offbreak	181*	New Zealand v West Indies at Napier, Mar 1, 2006	"Ross Taylor has been a fulcrum of New Zealand's batting across formats for more than 10 years, a period that has brought consistent Test success, especially on home soil, and the appearance in consecutive World Cup finals. In the mid-2000s, he was just what New Zealand need in the wake of the mass of departures from their batting line-up: an aggressive top-order batsman capable of taking up the challenge to world-class attacks. In only his third ODI, Taylor hammered a superb 128 against Sri Lanka at Napier in 2006 and he followed it up with 84 at better than a run a ball in his first ODI outside New Zealand, at Hobart against Australia in January 2007. He scores heavily from the pull and from slog-sweeping the spinners (and sometimes the quicks). 
 Given New Zealand's lack of Tests it wasn't until the 2007-08 tour of South Africa that Taylor made his debut and he struggled against the extra bounce. Back at home he was dropped against Bangladesh, but returned in style against England with his maiden century, 120, at Hamilton and then followed that with a memorable 154 at Old Trafford. A leadership role wasn't too far away and he was named captain for the tri-series in Sri Lanka in 2010 after Vettori and McCullum opted out.
 However, Taylor's two-year captaincy stint ended in controversy when it emerged that he and Mike Hesson, the coach who took over from John Wright, didn't have a comfortable relationship. During Taylor's 13-Test captaincy stint New Zealand notched up rare wins in Australia and Sri Lanka, but immediately after the Sri Lanka tour he stepped down in controversial circumstances, as Brendon McCullum was named captain in all formats. After deciding not to tour South Africa, he returned for New Zealand's home series against England, admitting that his relationship with Hesson was still a ""work in progress"".
 While taking time accept the decision, Taylor quickly reasserted his importance to the middle order and produced a prolific run of form in 2013 with 495 runs in five innings in a three-match Test series against West Indies. In one-day cricket he formed what McCullum would often call 'the best three-four punch in world cricket' alongside Williamson as New Zealand built towards the home World Cup of 2015. A year before the tournament he scored three ODI hundreds in three innings against India and Pakistan. He was consistent rather than prolific at the World Cup, but afterwards scored three hundreds in five innings against England and Zimbabwe.
 Back in Test cricket, a career-best 290 came against Australia at the WACA in late 2015 and in 2019 added a third double century to his tally with 200 against Bangladesh.
 Although the body started to cause some issues, he remain key to the one-day side as they began the next four-year cycle when Williamson took over the captaincy from McCullum. One of his finest innings came against England, in Dunedin, in 2018 when he was batting on one leg due to injury and scored an unbeaten 181 to a big chase. At the 2019 World Cup he was key to New Zealand's impressive semi-final victory over India with a fine half-century in tricky conditions.Brydon Coverdale and ESPNcricinfo staff "	"=HYPERLINK(""https://www.espncricinfo.com/inline/content/image/1222465.html"",""Ross Taylor"")"	New Zealand
Angelo Mathews	Angelo Davis Mathews	June 2, 1987, Colombo 	33 years 271 days	Sri Lanka, Basnahira Greens, Basnahira North, Brothers Union, Colombo Kings, Colts Cricket Club, Combined Provinces, Delhi Daredevils, Kolkata Knight Riders, Pune Warriors, Sri Lanka A, Sri Lanka Under-19s	Allrounder	Right-hand bat	Right-arm medium	139*	Zimbabwe v Sri Lanka at Harare, Nov 28, 2008	"A robust batting technique, nagging consistency with the ball, and athleticism in the field, all set off by an imperturbable temperament, have made Angelo Mathews one of Sri Lanka's most prized assets and a figure on which the team hangs many hopes. He has risen quickly since earning wide acclaim with an acrobatic save in the 2009 World Twenty20, and in February 2013, became Sri Lanka's youngest ever Test captain at 25, after having been groomed for the post for two years.  
 In limited overs cricket, Mathews' all-round skills are almost indispensable. When he pulled a quad in the World Cup semi-final in 2011, he forced three changes to the XI that played in the final, as the team strove for the balance he single-handedly delivers. He began his international career with ambitions of becoming a genuine allrounder, but has since given primacy to his batting, and effectively plays as a specialist batsman in the Test side. 
 Often coming to the crease at No. 6, Mathews provides solidity to the lower-middle order, which had been a weakness for Sri Lanka prior to his arrival. In ODIs he has provided two unforgettable finishes - against Australia in 2010, and Pakistan in 2012 - stealing victory with a sublime, sustained assaults, but his best work has come in the Test format. In an outstanding 2014, in which he scored 1160 runs at an average of 77.33, Mathews' finest moment was the rousing 160 at Headingley, which transformed that match and saw Sri Lanka win their first Test series in England (not including the one-off Test in 1998). 
 Mathews' appointment to the captaincy has heralded a renewed focus on youth and development by the Sri Lanka selectors. Once a successful leader of the St. Joseph's College side and the Sri Lanka Under-19 team, Mathews has been charged with ushering in a new age of Sri Lankan cricket.Andrew Fidel Fernando"	"=HYPERLINK(""https://www.espncricinfo.com/inline/content/image/1223475.html"",""Angelo Mathews"")"	Sri Lanka
